{
  "name": "lookup-savings-balance-live",
  "version": "1.1.0",
  "app": {
    "id": "vendor-console",
    "startPath": "/login"
  },
  "inputs": {
    "memberId": {
      "type": "string",
      "pattern": "^[0-9]{5}$",
      "sensitive": false
    },
    "username": {
      "type": "string",
      "sensitive": true
    },
    "password": {
      "type": "string",
      "sensitive": true
    }
  },
  "outputs": {
    "savingsBalance": {
      "type": "money",
      "sensitive": true
    }
  },
  "businessOutcomes": {
    "MEMBER_NOT_FOUND": {
      "detect": {
        "textPresent": "No member matches"
      }
    }
  },
  "steps": [
    {
      "id": "s1",
      "intent": "Navigate to /login",
      "action": {
        "verb": "navigate",
        "value": "/login"
      },
      "target": {
        "chain": [
          {
            "by": "structural",
            "note": "navigation target"
          }
        ],
        "reasoning": "Recorded from discovery run."
      },
      "risk": "safe",
      "expect": {
        "textPresent": "Sign In"
      }
    },
    {
      "id": "s2",
      "intent": "Enter the provided operator username.",
      "action": {
        "verb": "type",
        "value": {
          "$input": "username"
        }
      },
      "target": {
        "chain": [
          {
            "by": "labelProximity",
            "role": "textbox",
            "anchor": "Username"
          },
          {
            "by": "tableCell",
            "column": "Cascade Credit Union — Operator Console\nv3.2.1-legacy • Session active",
            "rowContains": "Cascade Credit Union — Operator Console\nv3.2.1-legacy • Session active"
          },
          {
            "by": "structural",
            "note": "textbox #1 of 2 in main"
          },
          {
            "by": "geometric",
            "lastResort": true,
            "x": 705,
            "y": 245
          }
        ],
        "reasoning": "Recorded from discovery run."
      },
      "risk": "safe",
      "expect": {
        "elementValue": {
          "$self": true
        }
      }
    },
    {
      "id": "s3",
      "intent": "Enter the provided password to complete the login form.",
      "action": {
        "verb": "type",
        "value": {
          "$input": "password"
        }
      },
      "target": {
        "chain": [
          {
            "by": "labelProximity",
            "role": "textbox",
            "anchor": "Password"
          },
          {
            "by": "tableCell",
            "column": "Cascade Credit Union — Operator Console\nv3.2.1-legacy • Session active",
            "rowContains": "Cascade Credit Union — Operator Console\nv3.2.1-legacy • Session active"
          },
          {
            "by": "structural",
            "note": "textbox #2 of 2 in main"
          },
          {
            "by": "geometric",
            "lastResort": true,
            "x": 705,
            "y": 330
          }
        ],
        "reasoning": "Recorded from discovery run."
      },
      "risk": "safe",
      "expect": {
        "elementValue": {
          "$self": true
        }
      }
    },
    {
      "id": "s4",
      "intent": "Submit the completed login form to access the operator console.",
      "action": {
        "verb": "click"
      },
      "target": {
        "chain": [
          {
            "by": "roleName",
            "role": "button",
            "name": "Sign In"
          },
          {
            "by": "structural",
            "note": "only button in main"
          },
          {
            "by": "geometric",
            "lastResort": true,
            "x": 660,
            "y": 417
          }
        ],
        "reasoning": "Recorded from discovery run."
      },
      "risk": "safe",
      "expect": {
        "textPresent": "Home"
      }
    },
    {
      "id": "s5",
      "intent": "Open Member Search to look up member 12345.",
      "action": {
        "verb": "click"
      },
      "target": {
        "chain": [
          {
            "by": "roleName",
            "role": "link",
            "name": "Member Search"
          },
          {
            "by": "structural",
            "note": "link #2 of 16 in main"
          },
          {
            "by": "geometric",
            "lastResort": true,
            "x": 46,
            "y": 138
          }
        ],
        "reasoning": "Recorded from discovery run."
      },
      "risk": "safe",
      "expect": {
        "textPresent": "Member Search"
      }
    },
    {
      "id": "s6",
      "intent": "Enter the exact member ID to search for member 12345.",
      "action": {
        "verb": "type",
        "value": {
          "$input": "memberId"
        }
      },
      "target": {
        "chain": [
          {
            "by": "labelProximity",
            "role": "textbox",
            "anchor": "Member Number"
          },
          {
            "by": "tableCell",
            "column": "Cascade Credit Union — Operator Console\nv3.2.1-legacy • Session active\n\n\n\nGo  Welcome, operator | Sign Off",
            "rowContains": "Cascade Credit Union — Operator Console\nv3.2.1-legacy • Session active"
          },
          {
            "by": "structural",
            "note": "textbox #2 of 3 in main"
          },
          {
            "by": "geometric",
            "lastResort": true,
            "x": 417,
            "y": 167
          }
        ],
        "reasoning": "Recorded from discovery run."
      },
      "risk": "safe",
      "expect": {
        "elementValue": {
          "$self": true
        }
      }
    },
    {
      "id": "s7",
      "intent": "Submit the member search for member 12345",
      "action": {
        "verb": "click"
      },
      "target": {
        "chain": [
          {
            "by": "roleName",
            "role": "button",
            "name": "Member Search"
          },
          {
            "by": "structural",
            "note": "button #2 of 2 in main"
          },
          {
            "by": "geometric",
            "lastResort": true,
            "x": 397,
            "y": 323
          }
        ],
        "reasoning": "Recorded from discovery run."
      },
      "risk": "safe",
      "expect": {
        "anyOf": [
          {
            "textPresent": "Member Details"
          },
          {
            "$outcome": "MEMBER_NOT_FOUND"
          }
        ]
      },
      "onCondition": [
        {
          "if": {
            "textPresent": "session is about to expire"
          },
          "do": {
            "verb": "click",
            "targetName": "Continue"
          },
          "maxApplies": 1
        }
      ]
    },
    {
      "id": "s8",
      "intent": "Read the Balance cell for the Savings account row.",
      "action": {
        "verb": "read",
        "parseAs": "money",
        "saveTo": "savingsBalance"
      },
      "target": {
        "chain": [
          {
            "by": "roleName",
            "role": "cell",
            "name": "$4,320.10"
          },
          {
            "by": "tableCell",
            "column": "Balance",
            "rowContains": "Savings"
          },
          {
            "by": "geometric",
            "lastResort": true,
            "x": 575,
            "y": 34
          }
        ],
        "reasoning": "Recorded from discovery run."
      },
      "risk": "safe",
      "expect": {
        "outputPopulated": "savingsBalance"
      }
    }
  ]
}