{
  "name": "lookup-checking-balance",
  "version": "1.0.0",
  "app": {
    "id": "vendor-console",
    "startPath": "/t/cascade-cu/search"
  },
  "inputs": {
    "memberId": {
      "type": "string",
      "pattern": "^[0-9]{5}$",
      "sensitive": false
    },
    "username": {
      "type": "string",
      "sensitive": true
    },
    "password": {
      "type": "string",
      "sensitive": true
    }
  },
  "outputs": {
    "checkingBalance": {
      "type": "money",
      "sensitive": true
    }
  },
  "businessOutcomes": {},
  "steps": [
    {
      "id": "s1",
      "intent": "Navigate to /t/cascade-cu/search",
      "action": {
        "verb": "navigate",
        "value": "/t/cascade-cu/search"
      },
      "target": {
        "chain": [
          {
            "by": "structural",
            "note": "navigation target"
          }
        ],
        "reasoning": "Recorded from discovery run."
      },
      "risk": "safe",
      "expect": {
        "textPresent": "Sign In"
      }
    },
    {
      "id": "s2",
      "intent": "Enter the provided <username> username",
      "action": {
        "verb": "type",
        "value": {
          "$input": "username"
        }
      },
      "target": {
        "chain": [
          {
            "by": "labelProximity",
            "role": "textbox",
            "anchor": "Username"
          },
          {
            "by": "structural",
            "note": "textbox #1 of 2 in main"
          },
          {
            "by": "geometric",
            "lastResort": true,
            "x": 705,
            "y": 245
          }
        ],
        "reasoning": "Recorded from discovery run."
      },
      "risk": "safe",
      "expect": {
        "elementValue": {
          "$self": true
        }
      }
    },
    {
      "id": "s3",
      "intent": "Enter the provided <username> password",
      "action": {
        "verb": "type",
        "value": {
          "$input": "password"
        }
      },
      "target": {
        "chain": [
          {
            "by": "labelProximity",
            "role": "textbox",
            "anchor": "Password"
          },
          {
            "by": "structural",
            "note": "textbox #2 of 2 in main"
          },
          {
            "by": "geometric",
            "lastResort": true,
            "x": 705,
            "y": 330
          }
        ],
        "reasoning": "Recorded from discovery run."
      },
      "risk": "safe",
      "expect": {
        "elementValue": {
          "$self": true
        }
      }
    },
    {
      "id": "s4",
      "intent": "Submit the completed <username> login form",
      "action": {
        "verb": "click"
      },
      "target": {
        "chain": [
          {
            "by": "roleName",
            "role": "button",
            "name": "Sign In"
          },
          {
            "by": "structural",
            "note": "only button in main"
          },
          {
            "by": "geometric",
            "lastResort": true,
            "x": 660,
            "y": 417
          }
        ],
        "reasoning": "Recorded from discovery run."
      },
      "risk": "safe",
      "expect": {
        "textPresent": "Dashboard"
      }
    },
    {
      "id": "s5",
      "intent": "Open member search to look up member <memberId>",
      "action": {
        "verb": "click"
      },
      "target": {
        "chain": [
          {
            "by": "roleName",
            "role": "link",
            "name": "Member Search"
          },
          {
            "by": "structural",
            "note": "link #2 of 16 in main"
          },
          {
            "by": "geometric",
            "lastResort": true,
            "x": 46,
            "y": 138
          }
        ],
        "reasoning": "Recorded from discovery run."
      },
      "risk": "safe",
      "expect": {
        "textPresent": "Member Search"
      }
    },
    {
      "id": "s6",
      "intent": "Enter the requested member number for the member lookup.",
      "action": {
        "verb": "type",
        "value": {
          "$input": "memberId"
        }
      },
      "target": {
        "chain": [
          {
            "by": "labelProximity",
            "role": "textbox",
            "anchor": "Member Number"
          },
          {
            "by": "structural",
            "note": "textbox #2 of 3 in main"
          },
          {
            "by": "geometric",
            "lastResort": true,
            "x": 417,
            "y": 167
          }
        ],
        "reasoning": "Recorded from discovery run."
      },
      "risk": "safe",
      "expect": {
        "elementValue": {
          "$self": true
        }
      }
    },
    {
      "id": "s7",
      "intent": "Submit the member search for member <memberId>",
      "action": {
        "verb": "click"
      },
      "target": {
        "chain": [
          {
            "by": "roleName",
            "role": "button",
            "name": "Member Search"
          },
          {
            "by": "structural",
            "note": "button #2 of 2 in main"
          },
          {
            "by": "geometric",
            "lastResort": true,
            "x": 397,
            "y": 323
          }
        ],
        "reasoning": "Recorded from discovery run."
      },
      "risk": "safe",
      "expect": {
        "textPresent": "Member"
      }
    },
    {
      "id": "s8",
      "intent": "Read the checking account balance from the accounts table for member <memberId>.",
      "action": {
        "verb": "read",
        "parseAs": "money",
        "saveTo": "checkingBalance"
      },
      "target": {
        "chain": [
          {
            "by": "tableCell",
            "column": "Balance",
            "rowContains": "Checking"
          },
          {
            "by": "geometric",
            "lastResort": true,
            "x": 575,
            "y": 56
          }
        ],
        "reasoning": "Recorded from discovery run."
      },
      "risk": "safe",
      "expect": {
        "outputPopulated": "checkingBalance"
      }
    }
  ]
}