{
  "name": "parabank-account-balance",
  "version": "1.0.0",
  "app": {
    "id": "parabank",
    "startPath": "/parabank/index.htm"
  },
  "inputs": {
    "username": {
      "type": "string",
      "sensitive": true
    },
    "password": {
      "type": "string",
      "sensitive": true
    }
  },
  "outputs": {
    "balance": {
      "type": "money",
      "sensitive": true
    }
  },
  "businessOutcomes": {},
  "steps": [
    {
      "id": "s1",
      "intent": "Navigate to /parabank/index.htm",
      "action": {
        "verb": "navigate",
        "value": "/parabank/index.htm"
      },
      "target": {
        "chain": [
          {
            "by": "structural",
            "note": "navigation target"
          }
        ],
        "reasoning": "Recorded from discovery run."
      },
      "risk": "safe",
      "expect": {
        "textPresent": "About Us"
      }
    },
    {
      "id": "s2",
      "intent": "Enter the provided username in the login form.",
      "action": {
        "verb": "type",
        "value": {
          "$input": "username"
        }
      },
      "target": {
        "chain": [
          {
            "by": "structural",
            "note": "textbox #1 of 2 in main"
          },
          {
            "by": "geometric",
            "lastResort": true,
            "x": 366,
            "y": 314
          }
        ],
        "reasoning": "Recorded from discovery run."
      },
      "risk": "safe",
      "expect": {
        "elementValue": {
          "$self": true
        }
      }
    },
    {
      "id": "s3",
      "intent": "Enter the provided password in the login form.",
      "action": {
        "verb": "type",
        "value": {
          "$input": "password"
        }
      },
      "target": {
        "chain": [
          {
            "by": "structural",
            "note": "textbox #2 of 2 in main"
          },
          {
            "by": "geometric",
            "lastResort": true,
            "x": 366,
            "y": 362
          }
        ],
        "reasoning": "Recorded from discovery run."
      },
      "risk": "safe",
      "expect": {
        "elementValue": {
          "$self": true
        }
      }
    },
    {
      "id": "s4",
      "intent": "Enter the required username in the login form.",
      "action": {
        "verb": "type",
        "value": {
          "$input": "username"
        }
      },
      "target": {
        "chain": [
          {
            "by": "structural",
            "note": "textbox #1 of 2 in main"
          },
          {
            "by": "geometric",
            "lastResort": true,
            "x": 366,
            "y": 314
          }
        ],
        "reasoning": "Recorded from discovery run."
      },
      "risk": "safe",
      "expect": {
        "elementValue": {
          "$self": true
        }
      }
    },
    {
      "id": "s5",
      "intent": "Submit the login form using the provided credentials.",
      "action": {
        "verb": "click"
      },
      "target": {
        "chain": [
          {
            "by": "structural",
            "note": "only button in main"
          },
          {
            "by": "geometric",
            "lastResort": true,
            "x": 326,
            "y": 392
          }
        ],
        "reasoning": "Recorded from discovery run."
      },
      "risk": "safe",
      "expect": {
        "urlMatches": "/parabank/overview.htm"
      }
    },
    {
      "id": "s6",
      "intent": "Read the first account balance from the accounts overview.",
      "action": {
        "verb": "read",
        "parseAs": "money",
        "saveTo": "balance"
      },
      "target": {
        "chain": [
          {
            "by": "tableCell",
            "column": "Balance*",
            "rowContains": "13344"
          },
          {
            "by": "geometric",
            "lastResort": true,
            "x": 669,
            "y": 358
          }
        ],
        "reasoning": "Recorded from discovery run."
      },
      "risk": "safe",
      "expect": {
        "outputPopulated": "balance"
      }
    }
  ]
}